created_at,id_str,full_text,lang,location
2023-12-26,1739454182485266525,salah juang reformasi hapus kkn nepotisme politik dinasti lawan dinasti potensial bawa dlm pusar nepotisme mana penting keluarga kelompok utama kalah penting,in,Nusantara
2023-12-26,1739536037100269956,nasdem optimis anies cak imin raup 65 persen suara kalimantan barat milu,in,Jakarta
2023-12-26,1739537888231248331,rilis survei nasional indikator peta elektoral pasca debat capres cawapres periode survei telepon 23 24 desember 2023 live on youtube burhanmuhtadi,in,"Menteng, Indonesia"
2023-12-26,1739443475668758584,kubu belah halal curang pilpres 2024 dg tuju jegal pasang ganjar pranowo mahfud md,in,"East Borneo, Indonesia"
2023-12-26,1739664819366842660,pimpin partai politik indonesia sungguh berat posisi kuasa biaya kalah kalah iya kalah gala alias bokek alas tahan oposisi iya,in,"London, England"
2023-12-26,1739458346355425625,reformasi 98 gera mahasiswa gera anggap remeh orba colong mahasiswa gerak bola salju harto ahkirnya tumbang reformasi jilid 2 gerak kondisi dng 98,in,lokalisasi kelas teri
2023-12-26,1739543731152572438,resmi rumah menang ganjar mahfud jalan arjuno surabaya mas eri cahyadi serta partai partai gabung koalisi dukung ganjar mahfud potong tumpeng simbolis resmi rumah menang,in,Indonesia
2023-12-26,1739550425043579392,wakil ketua tim menang nasional tpn ganjar mahfud tgb muhammad zainul majdi ketua mahkamah konstitusi ketok palu mahfud tani tembakau kucur dbhcht mahfud ketuk palu dbhcht 2010 ratus miliar bagi,in,Indonesia
2023-12-26,1739465521907794236,video baru tim catat ppda 10 ga biar lawan umpan build up pressingnya stats possession shots imbang tim terap taktik beda let s go bahas,in,"Bali, Indonesia"
2023-12-26,1739564771450744884,lukas enembe sakit buzzer arah giring opini olah le cari alas hindar proses hukum gila kpk percaya buzzer dominan buzzer pdip,in,Tanah Jajahan
2023-12-26,1739618611323711565,alifurrahman influencer loyalis pdip kalap bilang m qodari mati 3 pilpres panik iya tingkat suara prabowo,in,
2023-12-26,1739562847729050009,hadap ribu mahasiswa jawa yogyakarta ketua dpp pkb gus imin cakiminow tekan dialog capai aspirasi aminajadulu aniesmuhaimin,in,"DKI Jakarta, Indonesia"
2023-12-26,1739564710020718631,insya allah presiden repvblik ind0nesia 2024 2029 pr0f dr haji anies rasyid baswedan tanah suci mudah berangkat tunai ibadah haji aamiin iya r0bbal alamiin aamiin allahumma aamiin,in,Indonesia
2023-12-26,1739552929764511819,gilak instruksi menang apa emak redaksi flag hasil kampanye caleg serendah hina istri wan angin hina prabowo istri,in,Indonesia
2023-12-26,1739490876832067920,sgie kalah iya kalah kilah macam2 mental cundang ajar sportif debat capres jujur aku prabowo kalah debat tsb entar kalah pilpres teriak2 curang,in,Indonesia
2023-12-26,1739539830357590381,abdurrahman wahid kenal gus dur kenal orang presiden ri 4 dobrak sejarah negeri era pimpin gus dur presiden ri berani lurus arti toleransi toleransi umat agama,in,"Jakarta Timur, DKI Jakarta"
2023-12-26,1739547845362143492,selepetan cak imin gibran deret proyek solo dana apbn fantastis,in,Indonesia
2023-12-26,1739687074285167085,gelisah fahrihamzah representasi frustasi koalisi usung paslon 02 genjot elektabilitas paslon 02 stagnan trend turun pasca debat cawapres 22 12 attitude,in,"DKI Jakarta, Indonesia"
2023-12-26,1739642762679763156,akibat ngotot ramai twitter x komen rt bayar rajakomen wan angin cak durian tinggal 03 saran dukung prabowo gibran main organik bayar komen bot menang sna drone emprit pilpres,in,Indonesia
2023-12-26,1739629520926507229,jokowi wakaf hidup nya jokowi skarang berani hadap jokowi gaspol adiannapitupul1 caleg dpr pdip,in,
2023-12-26,1739618717548626044,capres cawapres nomor urut 3 ganjar pranowo mahfud md pakai strategi dekat tetangga gaet calon pilih mungut suara surakarta jawa tps calon pilih tps tetangga,in,Indonesia
2023-12-26,1739477442606354828,calon presiden nomor urut 3 ganjar pranowo suara jawa solo raya solid menang ganjar mahfud pilpres 2024 optimisme muncul lantar konsolidasi dukung kader kader partai usung rawan tim menang,in,Indonesia
2023-12-26,1739522603336012173,efek debat capres medsos cak imin sukses populer slepetnomic,in,
2023-12-26,1739672514333438195,calon presiden nomor urut ganjar pranowo tawar integritas sikap antikorupsi 20 bidang legislatif eksekutif calon pilih kampanye jawa ganjar pranowo jargon 10 pimpin,in,Indonesia
2023-12-26,1739587344288870728,dongkrak nilai ekspor prabowo gibran lanjut hilir sda,in,Indonesia Raya 
2023-12-26,1739667608188977270,kaget susah cari sumber media tulis netral kait sejarah konflik biru semangka salah video bahas tuntas sejarah,in,Not associated to any fanclub
2023-12-26,1739569370052104362,sejahtera keluarga perhati khusus pbnu maju indonesia keluarga sejahtera pemberdayaanekonomikeluarga,in,
2023-12-26,1739607911729614980,egiargians ide konsep udh kembang cipta anies baswedan beliau taktik kampanye konvensi capres partai demokrat pilpres 2014 silam,in,
2023-12-26,1739522564232565185,jokowi nilai rapat golkar pdip aman temponasional,in,Indonesia
2023-12-26,1739488705633468553,dukung anies baswedan muhaimin iskandar 500 kiai 8 rekomendasi simak isi,in,Indonesia
2023-12-26,1739670062062301210,tulung terjemahin skaar warawiri tl ane melulu resah pdi p s ganjar 38 has the edge over prabowo 30 and anies 25 in three way presidential race roy morgan research,in,
2023-12-26,1739658028025319736,ganjar pranowo mahfud md peduli dalam dengar aspirasi harap kaum muda dengar aspirasi harap generasi terus cipta ruang ekspresi kreativitas,in,Indonesia
2023-12-26,1739477406300414127,logika teddy tjahjono kuat sih persib salah diri pssi 1930 lahir 1933 logika bawa persija lahir 1928 pakai logo monas bangun 17 agustus 1961 lho iya ga apple to apple,in,Ngadi King of The South
2023-12-26,1739520843854794977,beda kelas debat capres dukung prabowo langsung bilang menang wan angin banding cak durian dukung kilah cacing krem kalah iya kalah cok,in,Indonesia
2023-12-26,1739549828961665359,bagi wawancara epic indonesia wawancara 1 ahmad musadeq kamis tangal 25 oktober 2007 trans tv hasil ada wawancara eksklusif reportase sore pimpin jamaah al qiyadah al islamiyah jarang pimpin kultus,in,Fort de Kock
2023-12-26,1739710970589860239,banggar dpr ultimatum perintah bengkak apbn ikn swasta 0 0 investor antre antre blt,in,Jakarta
2023-12-26,1739579410788040852,ngotot putar masuk putar orang2 tekan intimidasi sandera lawan sikap mrk 70 30 takut ubah 50 50 peluang sandera hukum,in,Indonesia
2023-12-26,1739450764618293757,politik riang gembira kampanye cerdas mundur wir cari pimpin uji pimpin otak kosong janji salam d3mokrasi,in,
2023-12-26,1739632757763097050,indikator psi gak lolos pulang pergi senayan,in,"Cipayung, Indonesia"
2023-12-26,1739612403795734992,model kampanye dialogis modern ala anak muda model desak anies posisi buka banget prediksi topik sudut pandang muncul fair gaya monolog bual janji2 bagi2 sogo kuno jijik,in,"Dalem Kabagongan, Krg Kedempel"
2023-12-26,1739536554362802547,gak anies maju pilih kepala daerah dki pks kursi dki legowo dukung cln wakil gubernur gerindra sandy mundur pks legowo kursi wkl gubernur riza patria gerindra pks partai santuy santun,in,"DKI Jakarta, Indonesia"
2023-12-26,1739459024784146831,buzzer2 kasar paslon skip sebut wan angin den wadas panas situasi pribadi kontestasi pilpres 2024 2019 panas bangsa terkotak2 politis,in,Indonesia
2023-12-26,1739465700778156496,urai asalmangap memang rakyat beli makan umkm proyek makan siang gratis minimal uang edar daerah beli makan sedot pusat minimal sktr 30 tmsk korupsi pajak untung kontraktor,in,
2023-12-26,1739607622410731660,problem istilah waris pola pikir kolonial rakyat sbg binatang perah via kena pajak lestari istilah bentuk inlander dr radjiman sidang bpupk direspon hatta dlm urus pajak semena mena,in,"Depok, Indonesia"
2023-12-26,1739684029505618338,co captain timnas amin leontinus alpha edison program pinternet salah gagas timnas amin cepat jaring internet ri newsupdate update news text,in,
2023-12-26,1739660059385168349,darah tangan anggota tim paslon manfaat isu hadap korban genosida langgar ham serius dulang suara,in,"The Hague, The Netherlands"
2023-12-26,1739760023432253446,capres nomor urut 1 anies baswedan klaim giat desak anies pontianak besar datang newsupdate update news text,in,
2023-12-26,1739550501140910537,survei indikator psi pulang pergi gagal lolos senayan newsupdate update news text,in,
2023-12-26,1739524681844298207,tetiba rubah paksa uu cawapres baik posisi salah fatal salah paslon plipres 2024 perkosa konstitusi hasil anak haram noda demokrasi,in,Jakarta Capital Region
2023-12-26,1739462956998701325,bangsa indonesia harga kepempinan sbyudhoyono normal aceh pasca bencana tsunami harga tim brr badan rekonstruksi rehabilitasi aceh pimpin kuntoro bantu sudirmansaid,in,
2023-12-26,1739566941243863368,hasil saing masuk putar 01 03 02 fokus menang putar masuk putar relatif aman waspada menang garis finish 2,in,Indonesia
2023-12-26,1739643154763268164,baca twitnya revolutia ikut plototin tabel lucu2 dlm alas milih partai 1 4 2 pilih pks pilih pks suka jokowi 2 4 7 pilih golkar pilih golkar suka cak imin 3 suka surya paloh banyak pilih,in,Jakarta
2023-12-26,1739702439975256261,resty j cayah cak imin kuat double amin politikus tulen emang gaya jenaka lawan enteng suara pkb atas nasdem pks demokrat pan pulang pergi urut no 4 pdip gerindra golkar he is politically powerful,in,Earth
2023-12-26,1739484995025285572,akuisisi persib serikat pt pbb via dada rosada laku dg ceroboh emang masalah dibiarin bom bobotoh makan jargon profesional sponsor lain kitu2 weh b mun ledak pek weh der keun,in,Di antara Larashati dan Serat 
2023-12-26,1739520444880073031,2013 muhammadiyah tuai prof din syamsuddin gugat air minum kemas mk gugat kabul sayang perintah hapus atur kabul gugat prof din tim,in,Jakarta Capital Region
2023-12-26,1739666650658652670,prabowo bangun politeknik unggul aceh didik kunci,in,
2023-12-26,1739647914488812020,39 46 wajar harap menang 1 putar trendnya si bloon2 bilang takut yah 2 putar iya ampunn 2 putar sih gak harap dikalahin pura2 temenan,in,ig. @tetapKurawa 
2023-12-26,1739795571446263961,dagang kritik pribadi emosional pilih ps berfikir ps sdh tua cerdas otak tumpul iya negara pimpin org joget gagas dlm isi kepala lanjut no,in,
2023-12-26,1739657717617492421,jakarta janji kampanye realisasi gak janji kampanye kontrak politik rakyat laksana realisasi insha allah pilpres ayo dukung ubah,in,"Tomage-Fakfak, Indonesia"
2023-12-26,1739611754622267407,kisah mugiyanto korban culi 98 hajar setrum ancam bunuh hilang paksa sgl jahat culi siksa bunuh ampas merdeka orang laku hukum,in,Jakarta Capital Region
2023-12-26,1739751016399306854,sulit paham warga papua 1 pimpin lokal raja raja nusantara masalah belanda jajah 3 belanda korupsi 2 tegak hukum kpk hilang kredibilitas,in,
2023-12-26,1739529506271187031,doktertifa doktertifa orang ngelaporin aparat postingannya beliau fakta landas bukti2 sahih deskripsi serang ham kalian2 serang doktertifa subyek,in,
2023-12-26,1739644176772575590,survei indikator elektabilitas psi 200 persen,in,Jakarta
2023-12-26,1739731051692667117,isu tabung perhati gejala target plan a b kubu lapang digembosin 03 hasil 03 ga lolos putar 2 isu diledakin target lawan watch out,in,
2023-12-26,1739618078676394199,pius sdh maaf prabowo rekonsilisi andi arief gabung dng culik budiman sdh selesai kasus culi perdata culik maaf selesai sdh culi langgar ham berat,in,Jakarta Capital Region
2023-12-26,1739500507004391834,menang cak durian om brewok powerfull kuasa misi ubah jargon kampanye,in,Indonesia
2023-12-26,1739705480870818095,nenkmonica viralkan lapor kpu id dkpp ri cara2 curang pilpres versi sdh dimaenkn hayo brgerak pilpres bersih dn jujur adil kecurangn dimaenkn kpu kpu sanksi keras,in,
2023-12-26,1739499244736934263,suka suka politik indonesia tentu politikus 1 muhaimin iskandar mahfud md kader gus dur 2 jokowi gibran ganjar kader2 megawati 3 prabowo anies waris jaring dulunya besar amien,in,
2023-12-26,1739438991186010117,jejak jelas2 inkosisten kejut berani tabrak nilai moral jujur berani malu bicara kemarin beda tricky suka jebak tampil tubuh akan tunduk sopan asli suka,in,"Kota Surabaya, Jawa Timur. "
2023-12-26,1739442979029622815,bangun sendi lokalitas legalitas citra jokowi sejati lanjut ganjar mahfud kena joko widodo jokowi sanding maruf amin sesi debat capres cawapres 2019 tampil sederhana,in,Indonesia
2023-12-26,1739530767695544789,prabowo jadi muhaimin mahfud wakil upaya jadi gibran gibran terima tawar ganjar anies calon wakil presiden upaya terima tawar prabowo,in,
2023-12-26,1739512561555673232,rawat ingat anak cucu kelak persib pegang orang gila nama teddy tjahjono cs nama pt pbb hasil 2 bobotoh tewas gbla jelas hukum komunitas bobotoh aku rekayasa lahir klub tai,in,
2023-12-26,1739663660623200592,capres ajak menteri kalimat fahrihamzah olah leceh pilpres biaya hasil keringet rakyat sempit jabat kuasa ajang juang ide gagas indonesia depan,in,Warteg
2023-12-27,1739959768964620329,diah pikat o putri haprani partai demokrasi indonesia juang pdi p cucu ketua pdi p megawati soekarnoputri pdi juang mudamemilih pemilu2024,in,"ÜT: 62.478419,21.330711"
2023-12-27,1739905148112281722,menteri koordinator bidang politik hukum aman mohammad mahfud md calon partai demokrasi indonesia juang pdip oleh 24 5 prabowogibranistimewa bersamaindonesiamaju prabowogemoy prabowo subianto,in,
2023-12-27,1739868641934663959,menteri koordinator bidang politik hukum aman mohammad mahfud md calon partai demokrasi indonesia juang pdip oleh 24 5 prabowogibranistimewa bersamaindonesiamaju prabowogemoy prabowo subianto,in,
2023-12-27,1739853979235004836,menteri koordinator bidang politik hukum aman mohammad mahfud md calon partai demokrasi indonesia juang pdip oleh 24 5 prabowogibranistimewa bersamaindonesiamaju prabowogemoy prabowo subianto,in,"ÜT: -6.2343885,106.7582603"
2023-12-28,1740508270400557270,orang partai dlm jalan sejarah demokrasi indonesia alas membeci megawati pdi juang percik reformasi awal dr zalim mega lahir pdip sbg dobrak politik membeci pki antek orba rakyatindonesia genz,in,Indonesia
2023-12-28,1740383495019790599,bentangnegeri megawati karier dunia politik 1987 salah diri partai demokrasi indonesia juang pdip 199 2001 megawati lantik presiden indonesia pecat abdurrahman wahid,in,malang
2023-12-28,1740264625906807169,mantriss koalisi satu demokrasi adil sejahtera nasional demokrat indonesia juang sdh sabar lihat ketua partai gandeng tangan mesra sp trio indonesia emas,in,"Klaten, Jawa Tengah"
2023-12-28,1740239504303427823,retnosetyow4t jokowi jokowi bangun infrastruktur demokrasi indonesia presiden 9tahun 1bulan dukung awas rakyat partai pdi juang terima kasih partai usung,in,
2023-12-28,1740216209843609934,direktur eksekutif indonesia political review ujang komarudin presiden joko widodo jokowi pecah kongsi partai demokrasi indonesia juang pdip anggap salah alas jokowi rapat partai golkar presiden jokowi formal,in,
2023-12-29,1740696519198838818,santorinissun sdh 60an hidup partai pdip jaga pelihara indonesia pancasila uud 1945 partai pdip milik tokoh idiologis panutan bangsa partai numpang nikmat ramai nama demokrasi,in,"Gambir, Indonesia"
2023-12-29,1740653790406303882,hikayat pohon beringin megawati soekarnoputri ketua partai demokrasi indonesia juang pdi juang hadap milu 2024 lontar isu orde usaha bangkit pijak,in,Di Bawah Satu Bendera
2023-12-30,1741102877115031973,rawan kader caleg partai demokrasi indonesia juang pdip tuban gera blusukan door to door rumah rumah warga,in,Surabaya
2023-12-30,1741101375596179729,sekretaris jenderal sekjen partai demokrasi indonesia juang pdip hasto kristiyanto sebut kubu calon presiden capres calon wakil pre,in,
2023-12-30,1740923522317455622,pilih pdi juang partai usak sistim demokrasi indonesia,in,GorongGorong
2023-12-31,1741433346289238442,partai demokrasi indonesia juang kecam keras duga aniaya sukarelawan ganjar mahfud anggota tni boyolali tim kampanye prabowo gibran sesal aksi polhuk adadikompas,in,"Palmerah, Jakarta"
2023-12-31,1741432060898615769,partai demokrasi indonesia juang kecam keras duga aniaya sukarelawan ganjar mahfud anggota tni boyolali tim kampanye prabowo gibran sesal aksi polhuk adadikompas,in,"Palmerah, Jakarta"
2023-12-31,1741322561361965542,partai aku demokrasi isi dinasti contoh pdip partai demokrasi indonesia juang ketua gak ganti2 partai sehat iya regenerasi,in,Istana Awan
2024-01-01,1741815441113415698,selamat 2024 mari satu juang lawan otoritarianisme orde dinasti politik kuasa cegah mati demokrasi indonesia buatsemuabukansegelintir,in,Indonesia
2024-01-01,1741633919639044470,perintah partai pdi juang tipu rakyat indonesia konfirmasi banteng anti demokrasi,in,"Jakarta Barat, DKI Jakarta"
2024-01-02,1742196322021654989,teladan tokoh negarawan politis partai demokrasi indonesia juang pdi juang ketua dpr ri perempuan mic yth mama ketua dpr ri puanmaharani ri yth ketua dpr ri puan maharani,in,"Jawa Timur, Indonesia"
2024-01-02,1742063118917025866,partai demokrasi indonesia juang pdip sorot hasil hasil survei media giring opini publik,in,
2024-01-03,1742689340915077299,partai demokrasi indonesia juang buzzer 03 kampanye jatuh lawan politik gada prestasi ditunjukin yaa,in,"Sidoarjo, Indonesia"
2024-01-03,1742352867686822290,rayimaz nama panjang suka partai demokrasi indonesia juang,in,
2024-01-04,1743047824470897082,pangkalpinang klik calon legislatif partai demokrasi indonesia juang pdip dapil 4 camat garunggung no 5 kota pangkalpinang bekuk polisi khusus masya baca lengkap narkotika  psikotropika  obat larang calegpdipnyabu,in,
2024-01-04,1742808794151940428,partai demokrasi indonesia juang pdip kabupaten badung all out menang pasang capres cawapres ganjar pranowo mahfud md milu 2024,in,"Denpasar, Bali"
2024-01-05,1743244767419592946,partai demokrasi indonesia juang pdip gelar acara khusus ingat 10 januari sumber,in,Jakarta - Indonesia
2024-01-05,1743227110951620694,ingat ulang hut 51 partai demokrasi indonesia juang pdip gelar pekan acara had,in,
2024-01-05,1743125560900108455,hisyammochtar pdsi juang bang partai demokrasi solideritas indonesia,in,Dibawah Langit Allah. SWT
2024-01-06,1743688671499596142,sekretaris jenderal sekjen partai demokrasi indonesia juang pdip hasto kristiyanto nilai temu presiden joko widodo jokowi cal,in,
2024-01-06,1743531066647007624,ulang hut 51 partai demokrasi indonesia juang pdi juang 10 01 1973 10 01 2024,in,"Pekan Baru, Riau"
2024-01-06,1743530094734557231,jokowi hadir acara ingat ulang partai demokrasi indonesia juang pdip 51 pasal tepat acara puncak 10 1 jokowi jadwal kunjung negeri baca lengkap,in,Kalimantan Barat
2024-01-06,1743451699401101741,istana koordinator staf khusus presiden ari dwipayana sebut presiden joko widodo jokowi hadir hut 51 partai demokrasi indonesia juang pdip 10 01 24 lengkap baca,in,Jl. Rawa Terate II No.2
2024-01-07,1744140487425204262,ganjar app abdurarsyad ganjarpranowo lihat debat semalem swingvoters kayak ken pilih ganjar bicara sopan nada amarah isi nya jleb to the point by data pilih anies pdip ganjar partai kemarin ngusung jokowi bukti porak poranda demokrasi indonesia,in,solo jawa tengah
2024-01-07,1744008864042021186,anggota dpr ri fraksi partai demokrasi indonesia juang pdip trimedya panjaitan sebut ganjar pranowo ambisius calon presiden milu 2024 kerja ganjar jabat gubernur jawa,in,
2024-01-07,1743868201694625959,partai demokrasi indonesia juang pdip partai satu bangun pulang pergi solid menang pasang nomor urut pilpres 2024 ganjar pranowo mahfud md,in,"Denpasar, Bali"
2024-01-07,1743857193643024803,partai demokrasi indonesia juang pdip ingat ulang hut 51 10 januari 2024,in,"Denpasar, Bali"
2024-01-07,1743836595118288982,jakarta elektabilitas partai gerindra salip posisi pdi juang pdip muat hasil survei lembaga indikator politik indonesia 25 27 desember 2023,in,
2024-01-08,1744379154856907191,partai demokrasi indonesia juang pdi p cari aliansi anies baswedan takut kalah,in,
2024-01-08,1744301952283115599,temanpemilih kpu kabupaten luwu laksana terima sampai lapor dana kampanye ladk partai demokrasi indonesia juang pdip kabupaten luwu media center kpu kabupaten luwu minggu 07 01 2024 sampai ladk tugas hubung,in,Belopa
2024-01-08,1744248991930523853,kuat masyarakat modal ga kira2 megawati ga relevan inisiasi pilih langsung rakyat pilih mpr demokrasi indonesia matang beliau pdip gimanapun salah partai,in,Arcturian
2024-01-08,1744225346986393606,aju lapor dana kampanye ladk serah operator dpc partai demokrasi indonesia juang agung 22 15 wib terima langsung ketua divisi teknis selenggara anwar ansori,in,Kediri - Jawa Timur
2024-01-08,1744208634249449717,presiden jokowi aku terima undang resmi kait ulang partai demokrasi indonesia juang pdip 51 pekan tepat rabu 10 januari baca lengkap jokowi pdip berita,in,Jakarta
2024-01-08,1744204252694950398,partai demokrasi indonesia juang ingat ulang hut 51 10 januari 2024 solidbergerak,in,"Bogor Barat, Indonesia"
2024-01-08,1744203213975466220,aju urus dpc partai demokrasi indonesia juang pdip kabupaten luwu timur 15 53 wita hadir giat bawaslu kabupaten luwu timur kpumelayani pemiluserentak2024,in,"Malili, Sulawesi Selatan"
2024-01-08,1744203211345711168,temanpemilih partai demokrasi indonesia juang pdip sampai lapor dana kampanye ladk milu 2024 tempat kantor kpu luwu timur minggu 7 1,in,"Malili, Sulawesi Selatan"
2024-01-08,1744158984788234491,sekretaris tpn ganjar mahfud sekjen partai demokrasi indonesia juang pdip hasto kristiyanto sorot kondisi reaktif prabowo debat capres kali,in,
2024-01-09,1744867654199079375,jokowi hut pdip loh partai angkat tukang mebel gak apa nya kenal antero indonesia hadir kacang lupa kulit hancur citra usak demokrasi indonesia,in,"Siantar, Indonesia"
2024-01-09,1744818698257653806,selamat ulang partai demokrasi indonesia juang 51 via koran bogor,in,
2024-01-09,1744696451689783565,dirgahayu partai demokrasi indonesia juang 51 moga cinta rakyat jaga demokrasi tegak lurus konstitusi 51tahunpdiperjuangan pdiperjuanganm3nang,in,"Karangasem, Bali"
2024-01-09,1744657595653333050,yuwantino12 semangat ganjar mahfud md indonesia demokrasi konstitusi negara main penting pribadi partai politik semangat salam juang masyrakat jelata,in,"Jawa Barat, Indonesia"
2024-01-09,1744622456059596853,capres nomor urut 3 ganjar pranowo hadir ingat ulang 51 partai demokrasi indonesia juang,in,NKRI
2024-01-10,1745224321105289483,ganjarpranowo puanmaharani ri 51 mana partai pdi juang hadir demokrasi indonesia,in,Indonesia
2024-01-10,1745152874001367041,ingat hut 51 partai demokrasi indonesia juang pdi juang calon presiden nomor urut ganjar pranowo sambut inspirasi tema satyam eva jayate benar menang ganjar generasigotongroyong ganjarpresiden ganjaruntu,in,Indonesia
2024-01-10,1745125365339861049,ingat hut 51 partai demokrasi indonesia juang pdi juang calon presiden nomor urut ganjar pranowo sambut inspirasi tema satyam eva jayate benar menang pidato ganjar pranowo komitmen,in,Indonesia
2024-01-10,1745122714690761022,40 partai amanat nasional pan 30 partai adil sejahtera pks 30 partai bintang pbb 22 partai hanura 20 partai demokrasi indonesia juang pdi p 20 partai golong karya golkar 20 partai perindo,in,
2024-01-10,1745122623280021809,tempodotco libat pdip raya hut 51 salah partai politik utama indonesia peran partai politik bangun kokoh demokrasi negara,in,indonesia
2024-01-10,1745114827515986241,flora rita27 nyaiibubu ngak apa2 nama partai besutab nama gerindra gera indonesia raya sono pakai pakai partai demokrasi pakai juang democrazy umur hidup,in,"Mataram, Indonesia"
2024-01-10,1745114268117467348,ingat hut 51 partai demokrasi indonesia juang pdi juang calon presiden nomor urut ganjar pranowo sambut inspirasi tema satyam eva jayate benar menang pidato ganjar pranowo komitmen,in,
2024-01-10,1745114190703202489,ingat hut 51 partai demokrasi indonesia juang pdi juang calon presiden nomor urut ganjar pranowo sambut inspirasi tema satyam eva jayate benar menang pidato ganjar pranowo komitmen,in,
2024-01-10,1745113726200807470,ingat hut 51 partai demokrasi indonesia juang pdi juang calon presiden nomor urut ganjar pranowo sambut inspirasi tema satyam eva jayate benar menang sahabatganjar ganjarmahfud2024,in,"East Java, Indonesia"
2024-01-10,1745111462337761510,pdi juang dirgahayu pdi p kontribusi indonesia moga pioner demokrasi contoh demokrasi partai,in,
2024-01-10,1745097569972396310,kader muda partai golkar sadar mana labuh sadar partai mesin orba belenggu demokrasi kibar banteng pdi juang merdeka,in,"Jawa Timur, Indonesia"
2024-01-10,1745088858012709050,ingat hut 51 partai demokrasi indonesia juang pdi juang calon presiden nomor urut ganjar pranowo sambut inspirasi tema satyam eva jayate benar menang sahabatganjar ganjarpranowo generasigotongroyong,in,
2024-01-10,1745066596752937047,ramai selenggara ulang partai demokrasi indonesia juang pdip 51 rabu 10 1 sekolah partai lenteng agung jaksel presidenjokowi jokowidodo pdip ipol,in,Jalan Cirendeu Raya No 32 A RT
2024-01-10,1745064642811175377,ingat hut 51 partai demokrasi indonesia juang pdi juang calon presiden nomor urut ganjar pranowo sambut inspirasi tema satyam eva jayate benar menang sahabatganjar,in,"DKI Jakarta, Indonesia"
2024-01-10,1745063594298147055,bahagia birthday partai demokrasi indonesia juang prabowo gibran prabowogibran mahasiswi riau visimisicapres menangtanpamenjatuhkan indonesiamaju bersamaindonesiamaju dekade08 mendingprabowo terusmajubersamaprabowo,in,"DKI Jakarta, Indonesia"
2024-01-10,1745062565036851313,dirgahayu 51 partai demokrasi indonesia juang pdi juang moga pdi juang kuat wakil rakyat bangun indonesia amin aminajadulu hutpdiperjuanganke51,in,"DKI Jakarta, Indonesia"
