created_at,id_str,full_text,lang,location
2023-12-20,1737333396333060528,politikus senior partai demokrasi indonesia juang pdip hendrawan supratikno maklum partai politik partai politik gaet pres,in,
2023-12-20,1737328778580546024,kabar presiden joko widodo jokowi pindah partai alias kader partai demokrasi indonesia juang pdip cuat p,in,
2023-12-20,1737313054705274972,kali survei lsi denny partai gerindra lampau partai demokrasi indonesia juang pdip dasa hasil temu survei anyar tajuk dominasi pdip 2024 rilis selasa 19 12 2023,in,Jakarta Capital Region
2023-12-20,1737292224734568640,partai demokrasi indonesia juang pdip prediksi tumbang milu 2024 hasil survei baru banteng moncong putih salip gerindra,in,
2023-12-21,1737870171908554987,ketua bidang anggota organisasi dpp partai demokrasi indonesia pdi juang sukur nababan kapasitas calon wakil presiden cawapres nomor urut mahfud md j debatperdanacawapres jernihkanharapan,in,Jakarta
2023-12-21,1737706318549614713,puluh kader partai demokrasi indonesia juang pdip lampung dukung pasang capres cawapres prabowo gibran,in,"Lampung, Indonesia"
2023-12-21,1737672306363904230,baliho salah caleg dpr ri foto 2 foto perempuan edar purworejo jawa baliho baliho ter5sebut narasi sudut salah caleg partai demokrasi indonesia juang pdi p nusyirwan soejono beritapurworejo,in,"purworejo, jawa tengah"
2023-12-21,1737663594693906483,bumiserius7285 ganjarpranowo nama partai demokrasi indonesia juang iya juang juang demokrasi tegak demokrasi indonesia partai juang boneka kkn,in,Indonesia
2023-12-21,1737642893534495196,nikmatul sg milik peran bangkit semangat satu anggota dukung partai demokrasi indonesia juang,in,
2023-12-22,1738218734219837448,pdi juang lupa belah berita tinggi kuantitas total hasil korupsi partai demokrasi indonesia juang pr beban ganjar mahfud tunggu bu mega bu puan tanggap,in,Indonesia
2023-12-22,1738123101471486115,sekretaris jenderal sekjen partai demokrasi indonesia juang pdip hasto kristiyanto tanggap santaiatas nyata wakil presiden wakil pres,in,
2023-12-23,1738630116648067525,allahu akbar partai pulang pergi pindah dukung no urut 1 hidayah amin,in,
2023-12-23,1738530070128648566,islam ajar cinta tanah air iman manusia tanggung negara kecut tinggal negara jajah kuasa negara palestina negara nabi allah,in,Jakarta Capital Region
2023-12-23,1738595479825645716,simak moga rakyat sadar rakyat itik giring jurang hancur tahu gelap saking dalam jurang sadar ayo 2024 ubah amin,in,
2023-12-23,1738500313928413523,gerak selamatkanindonesia ganti rezim,in,
2023-12-23,1738554184105140333,free palestine putera gaza alami perang generasi hidup intifada lewat perang serbu 2008 2012 2014 2012 2022 2023 agresi alami,in,Jakarta Capital Region
2023-12-23,1738353122089828587,rawan sobat anies dpd nganjuk teriak gerak sobatanies aminajadulu,in,"Yogyakarta, Indonesia"
2023-12-23,1738435167809876015,juang palestina mohon izin rs indonesia gaza paksa zionis israhel sbg markas militer juang palestina rendah hati izin indonesia ada serang rs indonesia sbg bentuk lawan zionis israhel,in,"Jawa Barat, Indonesia"
2023-12-23,1738710859776655863,milu malu milu 2024 dng cawe2 presiden widodo malu dlm sejarah anak widodo kontestan start dng skandal etika mk lolos anak presiden nyawapres kpu bawaslu dkpp aparat perintah dukung lahir dinasti,in,
2023-12-23,1738703086921875914,nonton pidio lbh seru dprd nonton netplik kpu bawaslu neng nonton video lengkap,in,~#
2023-12-23,1738705798170358229,pks milik kisah pastor jenguk wali kota bandung periode 2018 2021 alm h oded mohamad danial mang oded jatuh sakit fraksipksdprri pkspembelarakyat pksnomor8,in,Jakarta Capital Region
2023-12-23,1738381434681950667,debat calon wakil presiden mahfud md kalimat pamungkas 21 program unggul nila 2 500 triliun 5 cipta makmur sejahtera masyarakat indonesia pdiperjuangan ganjaruntuksemua ganjarpresiden,in,Indonesia
2023-12-23,1738490905689260511,bud budimandjatmiko 4 sahabat hilang 13 aktivis hilang lihat mas petrus hariyanto getar suara rasa sakit dihianati sahabat,in,"Semarang, Jawa Tengah"
2023-12-23,1738540658099736619,malam nonton bareng prof fx sugiyanto guru feb undip ikn swastanisasi bangga gibran turut rasional beban jangka,in,
2023-12-23,1738494790612975799,kali kali nyalon kalah serah cinta ikhlas beliau negeri jalan ucap gusdur orang ikhlas indonesia prabowo,in,"DKI Jakarta, Indonesia"
2023-12-23,1738390502637236277,duit kredit perban gerindra dokumen tempo alir dana kredit perban alir partai gerindra duga dana kampanye tayang sabtu 23 desember 2023 11 00 wib simak lengkap program bocor alus,in,Indonesia
2023-12-23,1738503870689800440,alhamdulillah bahagia sempat temu kiai pimpin pesantren pimpin majelis taklim pimpin masjid mushola kabupaten demak kuat bantu aktivis nu insyaallah kuat,in,Indonesia
2023-12-23,1738551622056480988,kesan tampil kandidat 01 juara cawapres gus muhaimin cakiminow visi ekonomi wujud adil makmur rakyat slepet bangun tidur gerak loyo slepet gus slepetajagus aniesmuhaimin2024,in,Jakarta Capital Region
2023-12-23,1738555816033341789,part 1 bawaslu uang haram ratus miliar alir partai politik bahaya ungkap publik nama partai politik dalam,in,
2023-12-23,1738709177382719648,bahlil pratikno tim bayang 2 tim non legal resmi daftar gera main pimpin cawe2 bantu mesti ikut,in,Zimbabwe 
2023-12-23,1738410240188768691,partai demokrat komitmen lanjut program2 profesional rakyat era perintah presiden sby lanjut baik sistem distribusi kelola program program profesional rakyat bpjs blt blsm pkh kur pnpm bos bidikmisi beasiswa santri,in,
2023-12-23,1738524375580815689,mdy asmara1701 beliau emg udh keren demokratis jaman gubernur org demoin kantor lgsung datengin ajak dialog bareng ngobrolduduk situ jabat udh nemu kaya gitu kah,in,"Bogor, Jawa Barat"
2023-12-23,1738696796015354270,haliburrahman ancam kpu berani ganggu gibran kpu ancam cc kpu id,in,
2023-12-23,1738422491109052736,sahabat lps yuk ikut giveaway lps 10 orang menang voucher go pay rp250 00 menang lengkap kalimat ikut follow media sosial lps instagram lps idic twitter lps idic,in,"Jakarta, Indonesia"
2023-12-23,1738354137056600433,dukung glorifikasi menang cerdas cermat sisi capresnya keri seremeuy jas nya gak sobek etika koyak sobek silah rakyat nilai model calon pimpin,in,"London, England"
2023-12-23,1738460801437229552,ganjar mahfud siap 21 program unggul nila 2 500 t tega hukum poin utama debatcawapres sgie mahfudlebihbaik3 satset3 mahfudjuara pilih prabowo gibran 2 00 t unk makan siang gratis ganjar mahfud 2 500 t unk 21 program unggul,in,"Kalimantan Timur, Indonesia"
2023-12-23,1738501483862307104,pilpres laku prinsip one man one vote sikap egaliter calon pimpin uji suara orang rakyat jelata nilai suara orang kyai profesor den wadas rm sederhana lolos,in,Indonesia
2023-12-23,1738475947102458172,mas anies gus imin bangun ekonomi indonesia hati otak aniesmuhaimin2024,in,"DKI Jakarta, Indonesia"
2023-12-23,1738538076664701195,performa debat cawapres kemarin malam 22 12 23 gus cakiminow versi juara tampil kandidat mvp mvp mkmkmk aminajadulu,in,Indonesia
2023-12-23,1738557221058052273,prabowo malu jokowi dg singkat istilah trik sampah serang cak imin mahfud md prabowo halal menang dg rendah sprt gibran,in,
2023-12-23,1738558224029376577,cak imin layak pilih sgie prabowo layak unk pilih sdh berkali2 pilpres tpid prabowo ga cak imin ga layak prabowo ga layak pdhl capres pas pilih ganjar mahfud debatcawapres,in,"Kalimantan Timur, Indonesia"
2023-12-23,1738481935310377124,respon publik media sosial omong masyarakat dunia nyata dapil lapang 1 luar duga orang debat malam gugur remeh mampu alamat mas gibran tweet,in,Kritik Kebijakan Bukan Pribadi
2023-12-23,1738696475042091404,detik detik prabowo tangkap kamera isyarat potong leher bahlil lepas suasana becanda satire isarat potong leher cengkeram ujung baju ndasmu emosi debat watak bengis prabowo,in,
2023-12-23,1738557202955477045,indonesia hitung untung rugi juang kenal serah bangsa rakyat sumber tuju juang in mimpi perintah bersih akomodatif prcayakan ganjar mahfud wujud it ganjaruntuksemua ganjarpresiden,in,"ÜT: -6.1389099,106.7214539"
2023-12-23,1738576116368212343,matur nuhun jawa timur indah alam lupa taut erat keramahtamahan hangat jalin dekap cinta kasih pdiperjuangan ganjaruntuksemua ganjarpresiden menangkanganjar ganjarmahfud ganjarmahfud2024,in,Indonesia
2023-12-23,1738548950632993184,nii itb 15 teman ambil kuliah pilih tugas diskusi via chat tugas via yahoo messenger tanda umur tabel tabel isi bilang,in,"Michuhol-gu, Republic of Korea"
2023-12-23,1738401103900000674,pongah under estimated lawan posisi takut debat dengan diam lawan keras ajar sungguh2 hasil kejut data drone emprit,in,Indonesia
2023-12-23,1738572016444477466,ndul bhw kerja brikan ahli hasil hancur serah kerja ahli hasil uda bukti uji ganjar mahfud ganjaruntuksemua ganjarpresiden,in,"ÜT: -6.1389099,106.7214539"
2023-12-23,1738655569639243999,penddk israhell sih lihat pakai teropong jarak nol save 4 juta number ngopi saudara laki jelang shubuh nikmat moga saudara palestina allah bahagia rsindonesia palestine brigadejulidfisabilillah,in,indonesia
2023-12-23,1738562163839811652,gin salah daku gassganjarmahfud sinergi caleg partai pdip ga peduli siang ga peduli malam pokok gasspuool pantang kendor ganjarmahfudm3nang,in,Indonesia
2023-12-23,1738402016802775353,jagung tanam lahan hektar hektar desa tewai kabupaten gunung mas kalimanta polybag lahan 600hektar tanam singkong prabowo gagal anak tani hidup desa malu,in,"Jawa Tengah, Indonesia"
2023-12-23,1738433528638144953,lega banyak sadar trick pakai sah sah substansi cari pimpin kapasitas integritas tricky wysiwyg moga debat debat debut rakyat,in,🌞
2023-12-23,1738513748770566473,direktur politik 5 0 tim menang nasional tpn ganjar pranowo mahfud md andi widjajanto calon wakil presiden cawapres nomor urut 3 mahfud md tempat hukum pandu ekonomi tumbuh catat mahfud tawar 21,in,Indonesia
2023-12-23,1738499723735306670,ketua tim menang nasional tpn ganjar mahfud arsjad rasjid aku puas papar mahfud md debat cawapres malam pasang nomor urut optimistis tumbuh ekonomi indonesia 7 tahun arsjad rasjid,in,Indonesia
2023-12-23,1738498746424717522,discipline is the strongest form of self love pandji disiplin bebas bangun self discipline tangguh rumus habit plan scra spesifik what when how start small make it easy repeat 30 days then forever,in,
2023-12-23,1738491240289853877,po doujin syopi 2 buka jam 12 00 wib besok tanggal 24 desember 2023 dm kali tambah 50pcs masing2 judul iya habis habis sisa ots cocoma 2024 update 1 serial killer x,in, 🇮🇩
2023-12-23,1738569501669769300,momen penuh hangat muhammad zinedine alam ganjar anak ganjar pranowo meng roasting sang ayah penuh ceria alam ganjar banyol plesetan lucu ganjar pranowo cipta suasana akrab momen,in,Indonesia
2023-12-23,1738470589504106998,komunikasi cawapres debat amat perilaku komunikasi gibran keluarga komunikasi tricky suka jebak akan gibran show up uang kampanye asli bagi gantung kunci benda,in,"Kota Surabaya, Jawa Timur. "
2023-12-23,1738543821393400014,percaya masyarakat pasang ganjar mahfud tingkat data sna drone emprit acara debat capres cawapres masyarakat percaya presentasi papar,in,🌞
2023-12-23,1738517618359758939,prmasalahan ekonomi sulit maju korupsi sbnrnya pmimpin masalah it mrk brnyali mmberantas korupsi skedar triak lawan korupsi pdhl mminta ketua kpk intevensi korupsi ganjar mahfud brnyali ganjaruntuksemua,in,"ÜT: -6.1389099,106.7214539"
2023-12-23,1738450177361580148,bicara poin inti akar utama bangsa fokus prof berantas korupsi akar iya sosok prof mahfud liat resi masa pola pikir logis sistematis perlu,in,🌞
2023-12-23,1738484616145875419,pdi juang puas tampil debat prof mahfud sosok alam berantas korupsi bicara manfaat bijak tingkat sejahtera cilik hasto siar pers sabtu 23 12 hasto anggap,in,Indonesia
2023-12-23,1738437053384405190,direktur ipo bagus ekspresi paham gibran,in,Indonesia
2023-12-23,1738569441980666100,cak imin nilai jujur istilah sgie debat cawapres,in,
2023-12-23,1738566581859532971,mimin cah ugm ki neng banget mahasiswa dicacatcocoti ketimbang puja puji contoh anak ugm presiden ri puja puji gila kuasa korupsi berantas berantas komisi atas wier wier minggir wie,in,Gejayan
2023-12-23,1738540002555085210,misi naik anggar tahan indonesia 48 gdp ada wajib militer umur produksi uranium iran korea utara pasti anak anak rebut hawaii taiwan 5 jabat,in,"Dunder Mifflin, Scranton"
2023-12-23,1738486213273952364,ganjar mahfud 2 500 t program hasil nikmat rakyat indonesia prabowo gibran 200 t program hasil pilih sappo debatcawapres mahfudlebihbaik3 satset3 mahfudjuara ganjar mahfud siap 21,in,Indonesia
2023-12-23,1738372197104931108,2015 jokowi bilang ekonomi kreatif tulang punggung ekonomi indonesia gibran jual hadap kerja gak beres 2017 bps 1 3 kerja ekonomi kreatif cont,in,
2023-12-23,1738564487526133806,beli gedung2 asset perintah jakarta tinggal,in,
2023-12-23,1738505583635128507,ratus anak muda main musik genteng sambut hadir calon presiden ganjarpranowo majalengka 23 12 2023 temu salam sapa warga kuat tali saudara mantaps warge majalengka,in,"Depok, Jawa Barat"
2023-12-23,1738396402957623705,bikin app super canggih bangun engineer alam 20thn bidang nya rilis guna kali megang komputer jarang megang komputer gapunya komputer mouse,in,Indonesia
2023-12-23,1738553090293542930,nelayan indramayu jawa barat jabar nama amirudin keluh capres nomor urut 3 pilpres 2024 ganjar pranowo momen keluh kesah bajak laut ganjar dialog nelayan karangsong indramayu sabtu,in,Indonesia
2023-12-23,1738556311993000413,analisis pakar psikologi forensik jelas gibran debat bingung bikin sesat paham,in,Indonesia
2023-12-23,1738558514858176874,bahlillahadalia masalah thdp gibran anak muda jadi cawapres ubah atur putus mk dg langgar etika berat paman,in,
2023-12-23,1738382380371738719,teman2 euforia paska debat kindly remind lihat timeline x masing2 rancang algoritma echo chamber mayoritas opini tuju mayoritas indonesia beda,in,Jakarta Capital Region
2023-12-23,1738708163023847628,bahlillahadalia yth nyata akan konfirmasi bhw 1 kaya pjbt jahat 2 anggap bhw orang jabat lbh jahat 3 bhw akan normal pjbt jahat inti bhw sombong pjbt,in,
2023-12-23,1738695583182004649,debat bahas teori2 topik istilah2 asing erti warga negara 1 jalan rusak layak lubang 2 sungai kali salur buang air kotor jorok kotor 3,in,"Rotterdam, The Netherlands"
2023-12-23,1738348819258249291,pdip gibran jebak bahas sgie,in,
2023-12-23,1738568311720624183,tiru jebak bapak debat 2014 2019 sifat etika waris,in,
2023-12-23,1738395096578703516,koreksi cak cakiminow debat jawab singkat padat ceramah kuliah kalimat skip manfaat visi misi mas gibran ulang,in,Jakarta Capital Region
2023-12-23,1738493966834930115,senjata rezim jokowi bunuh karakter hominem sebar isu bohong via buzzer teror batin kuasa milik imajinasi apa,in,Gejayan
2023-12-23,1738521122327638269,kpu mesti atur singkat dr paslon mesti panjang calon pakai istilah inggris maksud bgitu repot gus imin mahfud serang pakai dalil fiqih sukar erti calon,in,
2023-12-23,1738363213086171460,seru dr debat malam ribut dukung ekwkwkw gila,in,Jakarta Capital Region
2023-12-23,1738385908632834161,cermin bodoh anak pintar pura pura pintar sungguh mamerkan bodoh gimane lihat paman pecat ketua gegara ente suruh nutupi kurang umur ente gimane lari tubuh paman cela,in,
2023-12-23,1738580819218969028,tkn ancam lapor kpu dkpp tegur gibran aksi jeda debat malam minggu ngancam ngancam main ngeriik,in,~#
2023-12-23,1738561508299444596,langsung panjang jokowi prabowo 2014 kasih singkat tpid embel embel remeh maaf nyata sulit singkat sulit s ebaiknya g i ndahkan e tika,in,Singapore
2023-12-23,1738389047977103590,kompetisi kuat menang menang curang menang gak kalah hormat kalah iya kalah kompetisi boleh siasat gak kaget gaya 2012 jakarta,in,Indonesia
2023-12-23,1738465831141650845,bicara istilah asing pakai sgie pakai icor cak durian banget sgie program wapres ma ruf amin orang cak durian pinternya intrik ilmu,in,Indonesia
2023-12-23,1738570965909729422,lama2 kasihan kader pdip deddysitorus alami psikologis tinggal jokowi,in,Indonesia
2023-12-23,1738429018645602766,bilang wan angin dukung juang menang wan angin cak durian muas ego prabowo kalah 2014 2019 alas utama dukung wan angin,in,Indonesia
2023-12-23,1738483924496785833,survei indikator publik prabowo gibran 50 2 ganjar mahfud 23 1 amin 22 7 survei indikator publik nasional rilis survei tingkat elektabilitas 3 paslon pilpres 2024 hasil detikcom,in,
2023-12-23,1738423876982657446,warga lewat biasa bare minimum politik formatif bedak istilah kesan rumit substansi kopong persepsi warga segitunya geser oh bagus gosh we reply doomed,in,Phoebe Bridgers lives here
2023-12-23,1738421460342083742,calon presiden nomor urut 1 anies baswedan apresiasi dpw pks jakarta sistematis organisir hadap milu 2024 awal suara rakyat,in,
2023-12-23,1738489133553832136,beda berani kritik junjung prabowo gibran menang kritik kebijakan2 rugi rakyat persis laku jokowi 2014,in,Indonesia
2023-12-23,1738352831776883132,aku kalah nilai debat iya nilai batas debat kelit si a hebat debat debat game sendiri kalah iya aku kalah prabowo kemarin babak bur debat dukung prabowo,in,Mojokerto
2023-12-23,1738408551528440048,salah intervensi besar perintah kolonial belanda arsitektur indonesia momentum wabah pes rebak jawa timur 1910 1920an 1,in,"ÜT: -6.639885,106.839999"
2023-12-23,1738512378600550442,cak durian untung kalah putar drpd kalah putar manfaat gerbong negosiasi calon menang kuat wan angin gerbong now or never erti son,in,Indonesia
2023-12-23,1738577073105740181,negara konon negara demokrasi besar praktek demokrasi minim depan jadi keras sadis iya,in,
2023-12-23,1738441666749731311,romeogadungan dukung 01 debat capres debat emang bikin lawa kalah sah sah main kata2 debat cawapres ga respect gibr jebak lawan katakata,in,Somewhere
2023-12-23,1738545421734277419,kritik anggap peran domestik perempuan default gambar dr poster jokowi bawa norma sosial peran perempuan domestik afirmasi iya perempuan melulu domestik kritik,in,JKT ✈️ Gadigal unceded land
2023-12-23,1738389534554067116,debat tanding jelang tanding 14 februari 2024 kalah tanding sulit aku kalah tanding pakai narasi kalah curang,in,Mojokerto
2023-12-23,1738438955572617417,belladhonns loh engga gitu maksud debat siap emg ngang ngeng ngong ntar2 bilang video kurang2in inpromptu nongol resmi2 biar bukti malam,in,Indonesia
2023-12-23,1738385248285811014,rawa bahas isi debat bahas prabowo bahlil kalah debat cari alibi nemuaskan onani konten cari parah,in,sumatera-jakarta
2023-12-23,1738537959983563018,debat sebal main culas nya jebak lawan singkat bahasa ingris pakai literatur lokal debat pura2 salim nunduk nunduk persis pura pura tunduk injak bumega paham menang 51 warga,in,PSW Tower Antasari
2023-12-23,1738549579887652942,surat manis mantan oposisi mas kah peristiwa 2019 prabowo juang ulama prabowo masuk istana oligarki ulama masuk penjara catat sejarah tokoh penghianat,in,"Kota Batam, Kepulauan Riau"
2023-12-23,1738526467850662046,jejak digital bahlil puja puji anies doa presiden netizen kontaminasi asam sulfat,in,
2023-12-23,1738499229012860988,pakar public relations muhammad sufyan apresiasi jujur cawapres nomor urut 1 muhaimin iskandar cak imin ajang debat cawapres jumat 22 12 gibran sgie,in,
2023-12-23,1738376118833713271,partai garuda gibran bukti debat kait gibran rencana debat cawapres bukti helat debat cawapres 22,in,
2023-12-23,1738451901711368203,debat guna hadap orang iman buruk apa tampil paslon denial apa paslon tebal iman moralitas pondasi hukum moral calon,in,"Yogyakarta, Indonesia"
2023-12-23,1738510948519088274,bapak bicara persis kait nawacita janji rakyat indonesia satu terealisir 10 pimpin anak obral omong gede kerja bapak periode kuasa,in,Jakarta
2023-12-24,1739038809256542376,partai bangkit bangsa partai gera indonesia raya partai demokrasi indonesia juang partai golong karya partai nasional demokrasi partai buruh partai adil sejahtera partai demokrasi partai s lidaritas indonesia partai ummat partai bintang,in,-
2023-12-25,1739212045944488184,sekjen partai demokrasi indonesia juang pdip hasto kristiyanto elemen bangsa ketua rukun tetangga rt kepala desa usaha terima intimidasi laksana pilpres 2024,in,
2023-12-25,1739135012845560183,sekjen partai demokrasi indonesia juang pdip hasto kristiyanto elemen bangsa ketua rukun tetangga rt,in,
2023-12-25,1739105386299547752,jokowi aneh tugas partai eh marah mas jokowi pilih rakyat partai demokrasi indonesia juang banteng moncong putih pilih rakyat indonesia babu partai terima,in,
2023-12-26,1739485611738955882,akun youtube tanparagi sebar fitnah pengadudomba prof mohmahfudmd fitnah islam negara indonesia trus kmren mahfud temu romo jemaat gereja katedral tanda islam edyan kutip statemen lengkap,in,Indonesia
2023-12-26,1739656302681280597,alhamdulillah tanda merdeka palestina depan mata zionis israhell laknat serta sekutu ambang hancur bisnis hancur biaya perang habis uang boikot mana prajurit gugur cacat depresi,in,Jakarta Capital Region
2023-12-26,1739497434550780398,dukung kaum buruh rakyat pasang amin luas daerah2 deklarasi dukung tambah buruh cerdas pilih amin no 1 temu curang ribut tempat amin,in,"Jatinegara, Indonesia"
2023-12-26,1739525975023788166,negara waris anak turun bangsa indonesia keluarga baginda berhala lacur elite politik pura pura buta penyalahgunaan kuasa sang paduka politis,in,
2023-12-26,1739714431620448331,maksud milu tanggal 14 februari 2024 besok iya konsisten iya wakandanomoreindonesiaforever,in,Jakarta Capital Region
2023-12-26,1739785206914314508,tulis kompas 27 12 23 kelas tengah chilean paradox studi dartanto 2023 periode 2019 2022 manfaat bijak program perintah fokus 20 persen kelompok bawah 10 kelompok atas,in,Jakarta
2023-12-26,1739720726394130646,desak anies pontianak kalimantan barat membludak anies baswedan bicara bangun pikir bangun pulau duduk pulau lokasi akan,in,"Bandung, Jawa Barat"
2023-12-26,1739570969386336374,sukidi keren intelektual muda muhamadiyah lulus harvard nyata layak renung demokrasi jaga mesti punishment andil bunuh demokrasi dlm milu,in,"ÜT: -6.306199,106.826988"
2023-12-26,1739535473394307125,gus cakiminow mas aniesbaswedan sepakat dwitunggal dukung belah gausah pecah belah aminajadulu,in,Indonesia
2023-12-26,1739557345410302251, kredit anak muda calon wakil presiden nomor urut muhaimin iskandar janji 5 persen dana anggar anggar dapat belanja negara apbn alokasi kredit usaha anak muda amin kakak kakak aminajadulu debatcawapres partainasdem,in,"ÜT: -6.177799,106.843475"
2023-12-26,1739765871751630936,sisi buruk indonesia pimpin presiden kalang intelektual pintar berani milik hubung internasional luas soekarno era nama indonesia segani dunia kancah internasional presiden indonesia soekarno,in,"Kuta, Indonesia"
2023-12-26,1739557084205924556,bintang lapang kampanye anies muhaimin always bintang lapang target selfie foto bareng publik iya daeng mosad moh said didu alias msaid didu bicara dasar fakta bantah kritik runcing,in,
2023-12-26,1739557334706528535, kredit anak muda calon wakil presiden nomor urut muhaimin iskandar janji 5 persen dana anggar anggar dapat belanja negara apbn alokasi kredit usaha anak muda amin kakak kakak aminajadulu debatcawapres partainasdem,in,"ÜT: -6.177799,106.843475"
2023-12-26,1739665633997095405,dasar rezim koplak jokowi panik takut banget ganjar menang dukung ganjar intimidasi yunarto wijaya skrg najwa shihab pantes survei charta politika uda gk mncul milik intimidasi dasar bodoh,in,.
2023-12-26,1739596443600777415,sanggup kerah aparat simpuh pangku hati rakyat ganjar anak rakyat,in,
2023-12-26,1739696773591863338,orang anggap potensi bahaya oligarki antek buzzerrp turun khusus fitnah aniesbaswedan partai khusus nyinyirin anies heran orang kenal pribadi beliau,in,Jakarta Capital Region
2023-12-26,1739512895468396924,acara haul makan gado gado bareng si doel kunjung kronjo semangat kolaborasi rano karno caleg pdi juang kompak juang ganjar mahfud sejahtera cilik insyaallah ikhtiar hadir harga,in,
2023-12-26,1739497923120103869,karakter debat gibran baca sulit kembang debat rika sudjiman debat perdana cawapres euforia paslon 02 fakta topik bahas gibran,in,Indonesia
2023-12-26,1739453200594575624,provinsi aceh milik sendiri hati keluarga perintah presiden sby alhamdulillah capai damai bangun pasca tsunami aceh kembang aceh maju kader,in,
2023-12-26,1739778566362190297,fatwa mui wajib pilih mik 2024 hukum haram golong putih ketuka capres penuh kriteria fatwa mui hukum haram korupsi iniloh fatwa mui haram korupsi 200,in,Jakarta
2023-12-26,1739710205058027596,fear mongering iya salah baca tulis upaya framing prabowo gibran tulis dapat kondisi dua pilih presiden wakil presiden ri tulis,in,
2023-12-26,1739602806963875978,jokowi tito kanavian menteri negeri main kotor vakum dprd lolos kaesang anak jokowi tum psi gubernur dki jakarta cepat pilih kepala daerah november 2024 september 2024 atur,in,Jakarta Capital Region
2023-12-26,1739700378684571959,orang papua nyata kpk tanggung hantar lukas enembe pulang papua bawa lukas enembe hidup hidup tinggal dunia jakarta kpk ketua kpk korupsi tangkap,in,Tanah Jajahan
2023-12-26,1739564962962641008,desak anies pontianak ketemu foundernya dagadu kampung tinggal pontianak,in,Jakarta - Palembang.
2023-12-26,1739509586347049024,sembilan jokowi lelah bangun infrastruktur indonesia sabang merauke tugas wajib presiden lupa jokowi ujung jabat lelah bangun dinasti politik,in,Paris van Java
2023-12-26,1739440775895957825,hadap alumni pondok pesantren miftahul huda 2 bayasari ciamis kh agus malik annawawi umum adik a epung kh asep saepul khiyar sdh caleg pulang pergi duga pimpi pulang pergi mndiskualifikasi mlalui pesan wa baliho foto amin nya ga jabat maaf yaa,in,"Ciamis, Indonesia"
2023-12-26,1739587646211694783,mohon maaf prabowo rakyat aceh beliau laku siap rakyat aceh depan prabowogibran2024 aceh,in,
